text|source|chunk_id
"§ 9 AGG gedeckt.

Damit liegt z. B. ein verhaltensbedingter Kündigungsgrund (ohne Abmahnungserfordernis) vor, wenn die

Leiterin eines katholischen Kindergartens einen geschiedenen Mann heiratet. Gleiches gilt bei Ehebruch,

Wiederheirat nach Scheidung, Werbung für eine andere Glaubensgemeinschaft. Dabei hat das Gericht eine

sorgfältige Interessenabwägung vorzunehmen, bei der auch berücksichtigt werden muss, ob der

Arbeitnehmer wegen seiner spezifischen Qualifikation die Möglichkeit hat, auch bei einem anderen

Arbeitgeber eine Arbeitsstelle zu finden.

Die Rechtsprechung des BAG steht teilweise im Gegensatz zur Rechtsprechung des EuGH. Der EuGH hält

die Kündigung des Arbeitsverhältnisses eines Chefarztes eines katholischen Krankenhauses wegen

Wiederverheiratung nach Ehescheidung für vermutlich nicht gerechtfertigt. Zwar könne die Religion eine

wesentliche, rechtmäßige und gerechtfertigte berufliche Anforderung für die konkrete berufliche Tätigkeit

sein. Die Beachtung der katholischen Ehegrundsätze sei jedoch wohl keine derartige berufliche

Anforderung, da auch nicht-katholische Chefärzte beschäftigt würden. Das BAG müsse diese Grundsätze

bei seiner Entscheidung berücksichtigen. Das BAG stellte daraufhin die Unwirksamkeit der Kündigung fest.

7 Beleidigungen und Bedrohungen

(HI568487)

Beleidigungen gegenüber dem Arbeitgeber oder gegenüber Vorgesetzten berechtigen grundsätzlich zur

ordentlichen Kündigung auch ohne vorangegangene Abmahnung. Grobe Beleidigungen können auch eine

außerordentliche (fristlose) Kündigung rechtfertigen. Dies gilt ebenso für Bedrohungen des Arbeitgebers

oder von Vorgesetzten.

Ehrverletzende Äußerungen können allerdings dann als weniger schwerwiegend und nicht für eine

Kündigung ausreichend angesehen werden, wenn sie in einer Auseinandersetzung gefallen sind, bei der

der Arbeitgeber oder der Vorgesetzte in Form und Inhalt unberechtigte Kritik äußerte und hierdurch der

Arbeitnehmer zu der ehrverletzenden Äußerung gereizt wurde. Maßgeblich sind die jeweiligen Umstände

des Einzelfalls. Zu berücksichtigen sind insbesondere der betriebliche und branchenübliche Umgangston,

der Bildungsgrad und der psychische Zustand des Arbeitnehmers sowie die Gesprächssituation.

Abzugrenzen ist die Beleidigung auch von der ebenfalls im Betrieb geschützten Meinungsfreiheit. In dem

Vorwurf gegenüber einem Vorgesetzten, er sei ein Ausbeuter, liegt noch keine Schmähkritik.

Beleidigungen oder üble Nachrede gegenüber Arbeitskollegen können ebenfalls eine verhaltensbedingte,

in Ausnahmefällen auch eine außerordentliche Kündigung rechtfertigen, wenn hierdurch der

Betriebsfrieden nicht nur vorübergehend gestört wird.

Unberechtigte schwerwiegende Vorwürfe eines Angestellten in leitender Stellung über Untergebene und

Vorgesetzte sind an sich geeignet, eine ordentliche Kündigung sozial zu rechtfertigen.

Werden solche Äußerungen im Rahmen privater Kommunikation getätigt, ist häufig die berechtigte

Erwartung damit verbunden, dass die Kommunikation vertraulich bleibt und nicht an den Arbeitgeber

oder Dritte weitergegeben wird. Grundsätzlich darf sich der Arbeitnehmer auf die vertrauliche Behandlung

Personal Office Platin Seite 6

Stand Produktdatenbank: 28.11.2023, Ausdruck vom 29.11.2023

Verhaltensbedingte Kündigung: Einzelne Kündigungsgründe (HI3459808)

Fachlich geprüft/geändert am: 24.10.2023

von Äußerungen im Rahmen privater Gespräche verlassen, auch wenn dort Beleidigungen oder

Ehrverletzungen von Vorgesetzten oder Kollegen erfolgen. In privaten Chatgruppen geäußerte stark

beleidigende, rassistische, sexistische und zu Gewalt aufstachelnde Inhalte über Vorgesetzte und andere

Kollegen unterliegen jedoch nur im Ausnahmefall einer berechtigten Vertraulichkeitserwartung und

können deshalb grundsätzlich zur Kündigung berechtigen.

Eine Drohung gegenüber dem Arbeitgeber, um umstrittene eigene Forderungen durchzusetzen, kann ein

Grund für eine verhaltensbedingte Kündigung sein. Allerdings handelt ein Arbeitnehmer nicht

rechtswidrig, wenn er dem Arbeitgeber in einem Kündigungsschutzstreit damit droht, einen Schriftsatz

mit einem bestimmten Inhalt beim Arbeitsgericht einzureichen, um einen Vergleich zu erzielen. Solange

der Arbeitnehmer nicht bewusst oder leichtfertig falsche Tatsachenbehauptungen aufstellt oder der

eingenommene rechtliche Standpunkt gänzlich unvertretbar ist, liegt keine Pflichtverletzung vor.

Die Drohung mit Selbstmord kann ein wichtiger Grund für die fristlose Kündigung sein, wenn der

Arbeitnehmer mit der Drohung bestimmte eigene Interessen oder Forderungen durchsetzen will.

8 Berufskraftfahrer, Verkehrsverstöße

(HI1852280)

Erhebliche Verkehrs- und Sicherheitsverstöße eines Lkw-Fahrers können nach erfolgloser Abmahnung die

verhaltensbedingte Kündigung rechtfertigen.

Auch der Drogenkonsum außerhalb der Arbeitszeit kann eine Kündigung rechtfertigen.

9 Betriebsfrieden und betriebliche Ordnung

(HI568488)

Wird der Betriebsfrieden durch Handlungen gestört, die das friedliche Zusammenarbeiten der

Arbeitnehmer untereinander oder mit dem Arbeitgeber erschüttern oder nachhaltig beeinträchtigen und

die nachteilige betriebliche Auswirkungen (z. B. Störungen des Arbeitsablaufs) haben, kann dies eine

ordentliche, in Ausnahmefällen sogar außerordentliche, Kündigung rechtfertigen.

Bei einem Streit zwischen 2 Arbeitnehmern, der den geordneten Betriebsablauf gefährdet, hat der

Arbeitgeber jedoch zunächst eine Vermittlungspflicht. Wird trotz der Vermittlungsbemühungen des

Arbeitgebers der Streit zwischen den Arbeitnehmern nicht beigelegt, kann der Arbeitgeber den im Streit

befindlichen Arbeitnehmern das Arbeitsverhältnis ordentlich kündigen. Macht der Arbeitgeber einen

annehmbaren Vermittlungsvorschlag, kann er dem Arbeitnehmer kündigen, der den Vorschlag ablehnt.

Bei Verstößen gegen die betriebliche Ordnung, beispielsweise gegen ein betriebliches Alkohol- oder

Rauchverbot oder bei Verstößen gegen Unfallverhütungsvorschriften, ist nach vorangegangener

Abmahnung eine ordentliche Kündigung möglich.

Die heimliche Aufzeichnung eines Personalgesprächs durch den Arbeitnehmer kann eine außerordentliche

Kündigung rechtfertigen.

10 Internet- und E-Mail-Nutzung zu privaten Zwecken

(HI1852281)

Bei dienstlichen Internet- und E-Mail-Anschlüssen handelt es sich um Betriebsmittel des Arbeitgebers,

die ohne dessen Erlaubnis nicht privat genutzt werden dürfen. Ein Anspruch auf Privatnutzung folgt auch

nicht aus Art. 9 Abs. 3 GG, wenn der Arbeitnehmer den Account für Zwecke des Arbeitskampfes nutzen

will.

Die private Internet- und E-Mail-Nutzung am Arbeitsplatz stellt nach der Rechtsprechung des BAG unter

mehreren Umständen eine Verletzung arbeitsvertraglicher Pflichten dar:

Nutzung entgegen einem ausdrücklichen Verbot des Arbeitgebers

Nichterbringen der arbeitsvertraglich geschuldeten Arbeitsleistung

Herunterladen erheblicher Datenmengen auf betriebliche Datensysteme (unbefugter Download)

Personal Office Platin Seite 7

Stand Produktdatenbank: 28.11.2023, Ausdruck vom 29.11.2023

Verhaltensbedingte Kündigung: Einzelne Kündigungsgründe (HI3459808)

Fachlich geprüft/geändert am: 24.10.2023

Zusätzliche Kosten aufgrund der privaten Nutzung

Rufschädigung des Arbeitgebers, weil strafbare oder pornografische Darstellungen

heruntergeladen werden

Dabei wiegt die Pflichtverletzung umso schwerer, je mehr der Arbeitnehmer bei der privaten Nutzung des

Internets seine Arbeitspflicht in zeitlicher und inhaltlicher Hinsicht vernachlässigt. Sie stellt einen

verhaltensbedingten, in schweren Fällen einen außerordentlichen Kündigungsgrund dar, wobei

grundsätzlich vorher abzumahnen ist. Eine vorherige Abmahnung ist nicht erforderlich, wenn der

Arbeitnehmer bei seinen Tätigkeiten nicht davon ausgehen kann, der Arbeitgeber werde sie dulden.

Hat der Arbeitgeber die Nutzung des Internets für Privatzwecke nicht untersagt, kann dennoch ein

verhaltensbedingter Kündigungsgrund vorliegen. Hier kommt es vor allem auf den Umfang der

versäumten Arbeitszeit oder einer durch die Nutzung herbeigeführten Gefahr der Rufschädigung des

Arbeitgebers (heruntergeladene Erotik und Pornografie) an.

Die exzessive private Internet- und E-Mail-Nutzung während der Arbeitszeit kann jedoch auch bei einem

fehlenden Nutzungsverbot einen Grund für eine außerordentliche Kündigung darstellen.

Installiert der Arbeitnehmer für seine Internetnutzung unerlaubt Anonymisierungssoftware, liegt darin

eine schwere Pflichtverletzung, die einen verhaltensbedingten Kündigungsgrund darstellen kann.

Problematisch für den Arbeitgeber ist das Kontrollrecht der Internet- und E-Mail-Nutzung. Zunächst

sind die Grundsätze der DSGVO und des BDSG einzuhalten. Danach ist jede Form der Datenverwendung

verboten, sofern nicht ein Gesetz oder eine andere Rechtsvorschrift dies erlaubt oder anordnet oder der

Betroffene eingewilligt hat. Zur Prävention von Straftaten ist danach die Datenerhebung erlaubt, wenn

berechtigte Interessen des Arbeitgebers geschützt werden sollen und dies auch verhältnismäßig ist. Zur

Aufdeckung von Straftaten sind engere Voraussetzungen zu beachten. Hier müssten tatsächliche

Anhaltspunkte den Tatverdacht begründen, bevor im erforderlichen Umfang Daten konkreter Mitarbeiter

genutzt werden dürfen. Ist die private Internetnutzung gestattet, ist der Arbeitgeber Provider. Er muss die

Regelungen der §§ 12 ff. Telemediengesetz (TMG) und §§ 88 ff. Telekommunikationsgesetz (TMG), aber

auch die Telekommunikations-Datenschutzverordnung (TKDSVO) und das Teledienst-Datenschutzgesetz

(TDDSG) beachten, weil er ""Nutzern"" (vgl. § 2 Nr. 3 TMG) bzw. ""Dritten"" (Arbeitnehmern, vgl. § 3 Nr. 10

TKG) Übertragungswege anbietet und deshalb Diensteanbieter i. S. d. § 2 Nr. 1 TMG ist, bzw.

Telekommunikationsdienste i. S. d. § 88 Abs. 2 TKG erbringt. Deshalb muss er den Schutz des

Fernmeldegeheimnisses nach § 88 TKG gewährleisten.

Danach darf der dienstliche Internet- und E-Mail-Verkehr durch den Arbeitgeber weitgehend

uneingeschränkt protokolliert und in gewissem Rahmen auch inhaltlich kontrolliert werden. Eine

Vollkontrolle sämtlichen Verkehrs ist allerdings ausgeschlossen. Regelmäßige Stichproben und konkrete

Kontrollen bei Missbrauchsverdacht sind zugelassen. Der EGMR verlangt, dass die Überwachung

verhältnismäßig sein muss sowie, dass der Beschäftigte vorab über die Möglichkeit, die Art und das

Ausmaß der Kontrolle informiert wird.

Aus dem Vorgenannten folgt, dass Privatnutzung und dienstliche Nutzung streng getrennt werden

müssen, damit der Arbeitgeber zumindest die dienstliche Nutzung überwachen kann.

Der Arbeitgeber sollte deshalb klären,

ob er generell die private Internetnutzung gestatten oder verbieten will,

bei Gestattung die Nutzung innerhalb oder außerhalb der persönlichen oder betrieblichen

Arbeitszeiten zu erfolgen hat,

welche Nutzung er genehmigt oder ausschließt,

die beabsichtigten Überwachungsmaßnahmen bezeichnen (Umfang und Verwendung der

Protokolldaten sowie Speicherdauer) und

von jedem Arbeitnehmer vor der Gestattung der Nutzung eine Einwilligung nach § 4 Abs. 1

BDSG; § 12 Abs. 2 TMG; §§ 97 ff. TKG einholen.

Personal Office Platin Seite 8

Stand Produktdatenbank: 28.11.2023, Ausdruck vom 29.11.2023

Verhaltensbedingte Kündigung: Einzelne Kündigungsgründe (HI3459808)

Fachlich geprüft/geändert am: 24.10.2023

Besteht ein Betriebsrat, ist das Mitbestimmungsrecht des § 87 Abs. 1 Nr. 6 BetrVG zusätzlich zu

beachten. Es bietet sich daher an, die Internet- und E-Mail-Nutzung in einer Betriebsvereinbarung zu

regeln.

Verstöße des Arbeitgebers gegen die genannten Vorschriften können u. a. zu einem Verwertungsverbot

der hierdurch gewonnenen Erkenntnisse vor Gericht führen. Stützt der Arbeitgeber eine ausgesprochene

verhaltensbedingte Kündigung auf rechtswidrig erworbene Daten über die Internet- und E-Mail-Nutzung,

verliert er das Kündigungsschutzverfahren aus rein formalen Gründen. Das BAG hat ein

Verwertungsverbot bei Überwachung mittels eines Keyloggers angenommen.

Praxis-Tipp

Gestaltung der privaten Internetnutzung

Damit die Internetnutzung des Arbeitnehmers ggf. überprüft und die Daten verwertet werden dürfen,

z. B. im Rahmen eines Kündigungsschutzprozesses, ist die dienstliche Nutzung klar von der privaten

zu trennen. Dies kann durch die Definition privater Zeitkorridore (z. B. Mittagspause von 12.30 Uhr bis

13.00 Uhr), in denen die Privatnutzung gestattet ist, erfolgen. Ist die Privatnutzung außerhalb des

Korridors ausdrücklich untersagt, können hier zumindest stichprobenhafte, bei Missbrauchsverdacht

auch generelle Kontrollen erfolgen. Auch ist denkbar, im Betrieb mehrere Terminals aufzustellen, an

denen eine private Nutzung im Gegensatz zu den Arbeitsterminals zugelassen wird. Für den E-Mail-

Verkehr kann die dienstliche E-Mail-Adresse ausschließlich für den dienstlichen Verkehr bestimmt

werden, während Privatnutzung nur über Webmail-Dienste auf Internetbasis zu erfolgen hat. Damit

nicht die private Nutzung aus Duldungsgesichtspunkten erlaubt ist, sind regelmäßige Stichproben und

bei Missbrauch das Ergreifen von Sanktionen erforderlich.

11 Konkurrenztätigkeit

(HI568489)

Während des bestehenden Arbeitsverhältnisses ist dem Arbeitnehmer jedwede Konkurrenztätigkeit

gegenüber dem Geschäftsbetrieb seines Arbeitgebers untersagt. Dies gilt als selbstverständliche

arbeitsvertragliche Verpflichtung auch dann, wenn eine diesbezügliche Vereinbarung im Arbeitsvertrag

nicht enthalten ist.

Verletzt ein Arbeitnehmer durch unerlaubte Konkurrenztätigkeit seine arbeitsvertraglichen Pflichten,

rechtfertigt dies je nach den Umständen des Einzelfalls eine ordentliche oder auch eine außerordentliche

Kündigung, wobei im Einzelfall auch eine Abmahnung nicht erforderlich ist, wenn dem Arbeitnehmer von

vornherein bekannt sein musste, dass die Konkurrenztätigkeit seinen Vertragspflichten widerspricht und

vom Arbeitgeber nicht hingenommen werden kann.

Eine verbotswidrige Konkurrenztätigkeit liegt jedoch erst dann vor, wenn sie aufgrund des Umfangs und

der Intensität der Tätigkeit auch grundsätzlich geeignet ist, die Interessen des Arbeitgebers spürbar zu

beeinträchtigen. Einmalige oder nur ganz sporadisch ausgeübte reine Freundschaftsdienste im

Marktbereich des Arbeitgebers muss dieser in der Regel hinnehmen, wenn diese den arbeits- und

wertmäßigen Umfang einer geringfügigen Gefälligkeit nicht übersteigen und unentgeltlich durchgeführt

werden.

Bloße Vorbereitungshandlungen für die Konkurrenztätigkeit, zum Beispiel der Erwerb einer

Handelsgesellschaft, die Anmietung von Betriebsräumen, der Einkauf von Einrichtungsgegenständen

sowie die Beschaffung von Materialien für die Aufnahme der Konkurrenztätigkeit nach Beendigung des

Arbeitsverhältnisses, stellen dagegen keine zur Kündigung berechtigende Umstände dar, da dem

Arbeitnehmer nach Beendigung des Arbeitsverhältnisses die Konkurrenztätigkeit erlaubt ist. Auch beim

Führen von Abwerbegesprächen mit Kollegen für das künftige eigene Unternehmen ist im Regelfall vor

der Kündigung eine Abmahnung auszusprechen.

Personal Office Platin Seite 9

Stand Produktdatenbank: 28.11.2023, Ausdruck vom 29.11.2023

Verhaltensbedingte Kündigung: Einzelne Kündigungsgründe (HI3459808)

Fachlich geprüft/geändert am: 24.10.2023

12 Leistungsmängel

(HI568490)

Erbringt der Arbeitnehmer nicht die geschuldete Arbeitsleistung, die von jedem Arbeitnehmer aufgrund

des Arbeitsvertrags erwartet werden darf, so kann das Arbeitsverhältnis nach erfolgter Abmahnung

gekündigt werden. Eine schlechte Leistung kann in Qualitätsmängeln bestehen oder in einer quantitativen

Minderleistung. Erforderlich ist eine langfristige Unterschreitung der Durchschnittsleistung um mehr als

ein Drittel. Abmahnungen sind immer erforderlich. Das LAG Köln vertritt die Auffassung, 2 Abmahnungen

reichen bei einer Reinigungskraft aus. Zur Begründung der leistungsbedingten Kündigung genügt jedoch

nicht die Begründung, der Arbeitnehmer habe unterdurchschnittlich gearbeitet, weil in einer sehr guten

Gruppe schon der gute Arbeitnehmer unter dem Durchschnitt arbeitet.

Im Kündigungsschutzprozess ist der Arbeitgeber darlegungs- und beweispflichtig für das Vorliegen von

Leistungsmängeln sowie für die zuvor erfolgte Abmahnung.

Durch pauschale Werturteile über die von einem Arbeitnehmer erbrachten Arbeitsleistungen genügt der

Arbeitgeber der ihm obliegenden Darlegungslast im Kündigungsschutzprozess grundsätzlich nicht. Zu

einem schlüssigen Vortrag gehört vielmehr die Darlegung, worin das Fehlverhalten eines Arbeitnehmers

im Einzelnen besteht und welche Pflichtwidrigkeit ihm zur Last zu legen ist.

Die Rechtsprechung gewährt dem Arbeitgeber eine vereinfachte Darlegungs- und Beweislast bei

Leistungen, die gegenüber dem Durchschnitt vergleichbarer Mitarbeiter um mindestens ein Drittel

niedriger sind. Der Arbeitgeber genügt dann seiner Darlegungspflicht, wenn er Tatsachen vorträgt, aus

denen ersichtlich ist, dass die Leistungen des Arbeitnehmers mehr als ein Drittel hinter denen

vergleichbarer Arbeitnehmer zurückbleiben. Alsdann ist es Sache des Arbeitnehmers, hierauf zu

entgegnen, z. B. darzulegen, warum er mit seiner deutlich unterdurchschnittlichen Leistung dennoch

seine persönliche Leistungsfähigkeit ausschöpft. Trägt der Arbeitnehmer derartige Umstände nicht vor,

gilt das schlüssige Vorbringen des Arbeitgebers als zugestanden (§ 138 Abs. 3 ZPO). Es ist dann davon

auszugehen, dass der Arbeitnehmer seine Leistungsfähigkeit nicht ausschöpft. Trägt der Arbeitnehmer

Entschuldigungsgründe vor, ist es wiederum Sache des Arbeitgebers, diese Gründe zu widerlegen. Neben

den vorgenannten quantitativen Leistungsmängeln gewährt das BAG die vereinfachte Darlegungs- und

Beweislast auch bei qualitativen Leistungsmängeln, z. B. wenn die Fehlerquote des Arbeitnehmers dreimal

so hoch wie beim Durchschnitt der vergleichbaren Mitarbeiter ist. Allerdings muss der Arbeitgeber auch

die Art, die Schwere und die Folgen der Fehler darlegen und die betrieblichen Beeinträchtigungen

aufzeigen, die für ihn nicht mehr hinnehmbar sind.

Auch fehlende Führungsfähigkeiten können nach vorangegangener Abmahnung eine ordentliche

Kündigung rechtfertigen. Im Kündigungsschutzprozess reichen jedoch auch hier allgemeine Aussagen zur

fehlenden Führungskraft nicht aus.

Praxis-Beispiel

Fehlende Angabe konkreter Führungsfehler

Einer Führungskraft wird vorgeworfen, die ihr unterstellten Mitarbeiter seien nicht ausreichend

motiviert und/oder hätten das schlechteste Ergebnis erzielt. Diese Angabe ist im

Kündigungsschutzprozess nicht ausreichend substantiiert, da die mangelnde Motivation der

Mitarbeiter unterschiedliche Ursachen haben kann und nicht von vornherein ausschließlich der

Führungskraft anzulasten ist.

Ausreichend ist jedoch die Angabe konkreter Führungsfehler, beispielsweise wiederholte unberechtigte

Kritik gegenüber Mitarbeitern, Übertragung von Aufgaben auf unqualifizierte Mitarbeiter, fehlerhafte

Organisation der Arbeitsabläufe, mangelnde Koordination der Zusammenarbeit der Mitarbeiter,

unzureichende Delegation.

Personal Office Platin Seite 10

Stand Produktdatenbank: 28.11.2023, Ausdruck vom 29.11.2023

Verhaltensbedingte Kündigung: Einzelne Kündigungsgründe (HI3459808)

Fachlich geprüft/geändert am: 24.10.2023

Beruht die Schlechtleistung auf Alter, Betriebsunfall oder Berufskrankheit, kommt eine Kündigung aus

verhaltensbedingten Gründen nicht in Betracht.

13 Lohnpfändungen

(HI568491)

Lohnpfändungen berechtigen den Arbeitgeber nach der Rechtsprechung des BAG nur in Ausnahmefällen

zur Kündigung des Arbeitsverhältnisses. Ein solcher Ausnahmefall liegt vor, wenn über einen längeren

Zeitraum hinweg häufig Lohnpfändungen vorkommen und dadurch derart erhebliche Verwaltungsarbeiten

beim Arbeitgeber anfallen, dass sie zu wesentlichen Störungen im Arbeitsablauf führen. Da Ursache der

Lohnpfändungen nicht die Verletzung von arbeitsvertraglichen Pflichten ist, sondern die Lohnpfändung"|data_input\Verhaltensbedingte_Kündigung _Einzelne_Kündigungsgründe-1.txt|33a67a01d19f4c7cbda96ebb479fafa6
